[
  {
    "id": "aeafff3e-9cae-4df2-8963-0f7345e6fc18",
    "schema_version": "1.0.0",
    "idempotency_key": "fixture-alert-1-create",
    "status": "NEW",
    "version": 1,
    "created_at": "2026-07-31T09:00:00Z",
    "updated_at": "2026-07-31T09:00:00Z",
    "created_by_role": "RUNTIME_AGENT",
    "title": "fixture-alert-title-1",
    "description": "fixture-alert-description-1: a structural placeholder describing what was observed, no secret or personal data.",
    "source": "fixture-alert-source-1: a structural placeholder for a monitoring check name.",
    "severity": "MEDIUM",
    "category": "dependency",
    "entity_type": "content",
    "entity_id": "da55c079-bf1a-447c-8bcf-a56d4a179832",
    "acknowledged_by_role": null,
    "acknowledged_at": null,
    "resolved_at": null,
    "resolution_notes": null
  },
  {
    "id": "83d61760-7923-4935-ba35-aa04aaff30d6",
    "schema_version": "1.0.0",
    "idempotency_key": "fixture-alert-2-create",
    "status": "CLOSED",
    "version": 4,
    "created_at": "2026-07-28T09:00:00Z",
    "updated_at": "2026-07-29T09:00:00Z",
    "created_by_role": "RUNTIME_AGENT",
    "title": "fixture-alert-title-2",
    "description": "fixture-alert-description-2: a structural placeholder describing what was observed, no secret or personal data.",
    "source": "fixture-alert-source-2: a structural placeholder for a monitoring check name.",
    "severity": "LOW",
    "category": "policy",
    "entity_type": null,
    "entity_id": null,
    "acknowledged_by_role": "PHASE_OWNER",
    "acknowledged_at": "2026-07-28T10:00:00Z",
    "resolved_at": "2026-07-29T09:00:00Z",
    "resolution_notes": "fixture-resolution-notes-2: a structural placeholder, e.g. duplicate of another alert."
  }
]
